,index,company_name,industry,funding_stage,Amount_in_usd,about_company,year_funded,Founded,Founders,Investor,city,state,country
753,139,Prescribe,IT & Technology,Unknown,100000.0,Provide online services to patients by leveraging WhatsApp.,2020,2019.0,Nived Narayanan,Titan Capital,Chennai,Tamil Nadu,India
754,140,Nepra,IT & Technology,Scaling,18000000.0,NEPRA Resource Management provides waste management solutions in India.,2020,2006.0,Sandeep Patel,Asha Impact,Ahmedabad,Gujarat,India
755,141,inFeedo,Retail and E-commerce,Unknown,3200000.0,"inFeedo is a predictive people analytics company helping 300,000+ employees in 100+ companies make their voice feel heard and valued.",2020,2013.0,Tanmaya Jain,Peyush Bansal,Gurugram,Haryana,India
756,142,Shilpa Sciences,IT & Technology,Scaling,3000000.0,Shilps Sciences is a healthtech platform that claims to have solved gene editing by accelerating single gene cell applications.,2020,2014.0,Ashwin Lal,AngelList India,Bangalore,Karnataka,India
757,143,Arzooo,IT & Technology,Unknown,3000000.0,"B2B retail tech platform transforming 300,000+ SMEs in electronics space with its flagship ""Go Store"" product",2020,2016.0,"Khushnud Khan, Rishi Raj Rathore",3Lines,Bangalore,Karnataka,India
758,144,MindTickle,Retail and E-commerce,Exit Options,100000000.0,MindTickle offers the industry's most comprehensive sales readiness solution for closing knowledge and skill gaps in customer-facing teams.,2020,2011.0,"Deepak Diwakar, Krishna Depura, Mohit Garg, Nishant Mungali",Canaan Partners,Pune,Maharashtra,India
759,146,Slice,IT & Technology,Exit Options,5000000.0,Slice is a card for first-time credit card users. They are inventing the future of finance for young Indians,2020,2016.0,"Deepak Malhotra, Rajan Bajaj",Better Capital,Bangalore,Karnataka,India
760,147,Rapawalk,Retail and E-commerce,Early Traction,300000.0,Rapawalk is an online brand that offers a personalized service of creating your own shoes.,2020,2017.0,"Kashif Mohammad, Aravind Maddireddy",Sanjay Ramakrishnan,Bangalore,Karnataka,India
761,148,Oga Fit's,Sports,Scaling,3000000.0,The new-age home workout app that gives you an unmatched boutique digital fitness studio experience.,2020,2017.0,Ashish Rawat,9Unicorns,Bangalore,Karnataka,India
762,149,LAVAL,Consumer Goods,Scaling,3000000.0,"Laval Cosmetics, affordable makeup for all ages",2020,2016.0,"Shrishti, Prithika",Jazal Group,Bangalore,Karnataka,India
763,150,Stride Ventures,Retail and E-commerce,Unknown,80000000.0,Stride Ventures is a venture capital firm in India which aims to invest in innovative startups across the country.,2020,2019.0,Ishpreet Gandhi,Small Industries Development Bank of India,Delhi,Delhi,India
764,151,BlackSoil,IT & Technology,Unknown,10000000.0,Blacksoil Advisory is an independent boutique advisory firm.,2020,2016.0,Ankur Bansal,Undisclosed,Mumbai,Maharashtra,India
765,152,Biocon,Healthcare & Life Sciences,Unknown,15000000.0,"Biocon is a healthcare and technology, company focused on biotechnology.",2020,1978.0,Kiran Mazumdar-Shaw,Goldman Sachs,Bangalore,Karnataka,India
766,153,Clientjoy,Retail and E-commerce,Scaling,800000.0,Client Management Software For Modern Agencies.,2020,2013.0,"Abhishek Doshi, Anupama Panchal, Shashwat Bhatt, Yash Shah",LetsVenture,unknown,unknown,unknown
767,154,Xpressbees,Retail and E-commerce,Unknown,100000000.0,Xpressbees is an e-commerce logistics company that provides reliable logistics solutions to its partners.,2020,2015.0,"Amitava Saha, Supam Maheshwari",Alibaba Group,Pune,Maharashtra,India
768,155,GalaxyCard,IT & Technology,Early Traction,3000000.0,Mobile based Instant credit card. | Easiest way to get a credit card. Get one in 3 minutes,2020,2017.0,"Amit Kumar, Gunjeet Singh",India Accelerator,Gurugram,Haryana,India
769,156,Wellness Forever,IT & Technology,Unknown,100000000.0,Wellness Forever is the one-stop destination for wellness,2020,2008.0,"Ashraf Biran, Gulshan Bakhtiani, Mohan Chavan",Poonawalla,Mumbai,Maharashtra,India
770,157,MoooFarm,IT & Technology,Validation,500000.0,MoooFarm is an information technology company that bridges the technology gap to help marginalized dairy farmers.,2020,2019.0,"Param Singh, Aashna Singh, Abhijeet Mittal, Jitesh Arora",Navus Ventures,Gurugram,Haryana,India
771,158,BitClass,Retail and E-commerce,Early Traction,2000000.0,BitClass is a PaaS solution which helps teachers set up their independent live classes,2020,2020.0,"Gunjan Kejriwal, Utsav Tiwary",AET Japan,Bangalore,Karnataka,India
772,159,Gonuts,Retail and E-commerce,Early Traction,400000.0,Personalised Video shoutouts from favourite celebrity.,2020,2020.0,"Vinamra Pandiya, Mayank Gupta, Joji George",Sweta Rau,Mumbai,Maharashtra,India
773,160,Uolo,IT & Technology,Early Traction,2000000.0,Uolo Technology is founded by paranoid parents who want to make a difference to preschool experience.,2020,2013.0,"Pallav Pandey, Ankur Pandey, Siddharth Singh",Rajul Garg,Bangalore,Karnataka,India
774,161,Kirana King,Retail and E-commerce,Scaling,900000.0,"A revolutionary idea of standardization, digitization & centralization to traditional Grocery system.",2020,2014.0,Anup Kumar,Rajasthan Venture Capital Fund,Jaipur,Rajasthan,India
775,162,Jade Forest,Retail and E-commerce,Early Traction,250000.0,"NATURALLY THE BEST From zero artificial ingredients in our drinks to the way they make you feel, we bring you a bespoke range of natural mixers.",2020,2010.0,"Punweet Singh, Shuchir Suri",Undisclosed,Delhi,Delhi,India
776,163,iKure,IT & Technology,Unknown,3000000.0,iKure is a social enterprise that delivers primary healthcare and wellness & prevention services to communities in India,2020,2010.0,Sujay Santra,Ratan Tata,Kolkata,West Bengal,India
777,164,FrontRow,IT & Technology,Early Traction,3200000.0,"Comprehensive courses, taught by idols.",2020,2006.0,"Mikhil Raj, Shubhadit Sharma, Ishaan Preet Singh",Lightspeed,Bangalore,Karnataka,India
778,165,Reliance Retail,Retail and E-commerce,Unknown,10000000.0,Reliance Retail Ventures Limited is a subsidiary company of Reliance Industries Limited.,2020,2006.0,Mukesh Ambani,Abu Dhabi Investment Authority,Mumbai,Maharashtra,India
779,166,TUBBR,Media & Entertainment,Unknown,3000000.0,World's First Personal Social Network,2020,2019.0,"Saurabh Uttam, Ravi Singhal",Global Ascent Partners,Frisco,unknown,United States
780,167,Ather Energy,Retail and E-commerce,Scaling,35000000.0,Ather Energy is a manufacturer of electric scooters.,2020,2013.0,"Arun Vinayak, Swapnil Jain, Tarun Mehta",HeroMotoCorp Ltd and Sachin Bansal,Bangalore,Karnataka,India
781,168,Routematic,Retail and E-commerce,Unknown,2000000.0,Vision is to enable a safer and more comfortable commute to work for employees of India Inc.,2020,2007.0,"Sriram Kannan, Surajit Das",VAMM Ventures,Bangalore,Karnataka,India
782,169,LivFin,IT & Technology,Unknown,4700000.0,LivFin is a non-banking financial company registered with the Reserve Bank of India (RBI),2020,2017.0,Rakesh Malhotra,DEG,Delhi,Delhi,India
783,170,Universal Sportsbiz Pvt Ltd,Consumer Goods,Unknown,3000000.0,A fashion startup based in Bengaluru.,2020,2012.0,Anjana Reddy,Accel,Bangalore,Karnataka,India
784,171,Lattu Kids,IT & Technology,Unknown,3000000.0,Lattu kids is an edutainment platform for preschool kids.,2020,2017.0,Vivek Bhutyani,Mumbai Angels Network,Mumbai,Maharashtra,India
785,172,Eggoz,Retail and E-commerce,Scaling,1500000.0,"Eggoz is a brand of fresh and chemical-free eggs, produced in tech-enabled & nutrition-engineered deep integration partnership with farmers.",2020,2016.0,"Abhishek Negi, Aditya Singh, Pankaj Pandey, Uttam Kumar",AVANA Capital,Indore,Madhya Pradesh,India
786,173,Steradian Semiconductors,IT & Technology,Unknown,3000000.0,Semiconductor company focused on CMOS millimeter wave products for Radar.,2020,2016.0,"Gireesh Rajendran, Ashish Lachhwani, Apu Sivadas, Rakesh Kumar and Alok Joshi",Endiya Partners.,Bangalore,Karnataka,India
787,174,CHARGE+ZONE,Retail and E-commerce,Scaling,3000000.0,"Charge+Zone provides services in renewable energy solutions, product development, and software engineering company.",2020,2018.0,"Kartikey Hariyani, Pavan Bakeri",Mumbai Angels,unknown,unknown,unknown
788,175,Stones2milestones,IT & Technology,Exit Options,2000000.0,Stones2milestones is India (Delhi) Based EdTech Company,2020,2008.0,"Kavish Gadia, Nikhil Saraf",Menterra Venture Advisors,Gurugram,Haryana,India
789,176,Udacity,IT & Technology,Exit Options,75000000.0,"Udacity develops an online learning platform offering programs in artificial intelligence, machine learning, and robotics sector.",2020,2011.0,"David Stavens, Mike Sokolsky, Sebastian Thrun",Hercules Capital,California,unknown,unknown
790,177,AjnaLens,Retail and E-commerce,Exit Options,1000000.0,"AjnaLens develops AR/VR wearables primarily for the Defence, Education and enterprise customers.",2020,2014.0,"Abhijit Patil, Abhishek Tomar, Pankaj Raut",Mohsin Hani Al Bahrani,Thane,Maharashtra,India
791,178,Gully Network,Retail and E-commerce,Scaling,1200000.0,Gully Network is a tech-enabled network of mid-sized grocery stores.,2020,2019.0,"Ajay Nain, Prateek Chaturvedi",CP Ventures,Bangalore,Karnataka,India
792,179,TurboHire,Retail and E-commerce,Early Traction,1000000.0,Talent Intelligence Platform for enterprises that helps recruiters discover the right candidates for a job using a Human-like AI,2020,2018.0,"Abhishek Kabra, Aman Gour",Kia Ora Ventures,Hyderabad,Telangana,India
793,180,Traya,IT & Technology,Early Traction,3000000.0,work with our customers closely to get their hair health sorted for long-term effective results,2020,2015.0,"Altaf Saiyed, Saloni Anand",Kae Capital,Mumbai,Maharashtra,India
794,181,Charcoal Eats,Retail and E-commerce,Unknown,2000000.0,"In the last five years, have served over 1.5 million orders and enjoy high customer satisfaction.",2020,2015.0,"Anurag Mehrotra, Krishnakant Thakur, Mohammed Bhol, Gautam Singh",Lokmat Investments,Mumbai,Maharashtra,India
795,182,Mitron TV,Retail and E-commerce,Unknown,3000000.0,Mitron is a free short videoplatform for next generation,2020,2020.0,"Shivank Agarwal, Anish Khandelwal",9Unicorns,Bangalore,Karnataka,India
796,183,Svami,Retail and E-commerce,Unknown,800000.0,Svami is the result of three seasoned drinkers extending their love for libations to the larger world of drinks.,2020,2016.0,Sahil Jatana,Niren Shah,Mumbai,Maharashtra,India
797,184,Dhurnia,IT & Technology,Unknown,100000.0,Developer of an online learning platform intended for various competitive exam preparations.,2020,2018.0,"Ajay Kumar, Murari Singh",Chandigarh Angels Network,Dhingsara,unknown,unknown
798,185,Expertrons,IT & Technology,Unknown,3000000.0,Expertrons is an AI video bot platform created to help students and professionals prepare for interviews.,2020,2019.0,Jatin Solanki,Rohit Chanana,Mumbai,Maharashtra,India
799,186,Leena AI,Retail and E-commerce,Unknown,8000000.0,Leena AI offers a human resource management platform that transforms employee experience with conversational AI.,2020,2015.0,"Adit Jain, Anand Prajapati, Mayank Goyal",Alan Patricof,New York,unknown,United States
800,187,Bizlog,Transportation & Logistics,Unknown,1000000.0,Bizlog Value Chain enables re-commerce and circular economy through unique REVERSE LOGISTICS engine.,2020,2016.0,"HS Srinivasan, Krishnan Rajan, E.V. Shunmugam",IAN Fund,Bangalore,Karnataka,India
801,188,Tamasha.live,Media & Entertainment,Unknown,300000.0,"Tamasha offers a platform for influencers to host live, video based, real money contests and games.",2020,2020.0,"Saurabh Gupta, Siddharth Swarnkar",9Unicorns,Mumbai,Maharashtra,India
802,189,Fedo,Retail and E-commerce,Unknown,1000000.0,Artificial Intelligence based Credit Score for Health,2020,2017.0,"Arun Mallavarapu, Prasanth Madavana",AIM Smart City,Bangalore,Karnataka,India
803,190,FabHotels,Healthcare & Life Sciences,Unknown,1000000.0,Fabhotels is the online aggregator for hotel rooms. It aims to provide standardized services at economical budgets.,2020,2015.0,"Adarsh Manpuria, Vaibhav Aggarwal",RB Investments Pte. Ltd,Gurugram,Haryana,India
804,191,Freshokartz,IT & Technology,Scaling,1000000.0,"Freshokartz provides soil data based crop and fertilisers recommendation to farmers and delivery seeds, pesticides",2020,2016.0,"Chandrakanta, Rajendra Lora",Rajasthan Venture Capital Fund,Jaipur,Rajasthan,India
805,192,FlexiLoans,IT & Technology,Exit Options,6000000.0,"an online lending platform started with an endeavour to solve the problem that SMEs face in accessing Quick, Flexible and Adequate funds for growing their Businesses.",2020,2016.0,"Abhishek Kothari, Deepak Jain, Manish Lunia, Ritesh Jain",>Vikram Sud,Mumbai,Maharashtra,India
806,193,Agrix,IT & Technology,Unknown,3000000.0,"Farming-as-a-service (covering farm machinery and agri input services) and provides market linkages, especially for fragmented farm owners.",2020,2020.0,"Nilay Pandey, Saurav Singh, Vivek Kumar",Maple Capital Advisors,Patna,Bihar,India
807,194,BharatAgri,IT & Technology,Scaling,3000000.0,A Smart Farming Technology Platform for Indian Farmers,2020,2017.0,"Siddharth Dialani, Sai Gole",021 Capital,Pune,Maharashtra,India
808,195,FreshtoHome,Retail and E-commerce,Scaling,121000000.0,Freshtohome is an e-commerce platform for fresh and chemical-free seafood.,2020,2015.0,Shan Kadavil,Ascent Capital,Bangalore,Karnataka,India
809,196,Credable,IT & Technology,Unknown,4500000.0,CredAble provides working capital & supply chain finance programs for large enterprises and their suppliers and distributors.,2020,2017.0,Nirav Choksi,Oaks Asset Management,Mumbai,Maharashtra,India
810,197,Railofy,Transportation & Logistics,Early Traction,5000000.0,Railofy is a WL & RAC protection that enables waitlisted passengers to reach their destination at the lowest possible price.,2020,2019.0,"Rohan Dedhia, Vaibhav Saraf, Hrishabh Sanghvi",Roots Ventures,Mumbai,Maharashtra,India
811,198,Finova Capital,IT & Technology,Unknown,55000000.0,Finova Capital is a non-banking financial company.,2020,2016.0,"Mohit Sahney, Sunita Sahney",Sequoia Capital India,Jaipur,Rajasthan,India
812,199,Teachmint,IT & Technology,Early Traction,3500000.0,Teachmint is an easy to use platform for tutors to conduct unlimited live classes and manage their classrooms,2020,2020.0,"Mihir, Payoj Jain, Divyansh Bordia, Anshuman Kumar",Lightspeed India,Bangalore,Karnataka,India
813,200,Peel-Works,Retail and E-commerce,Unknown,3000000.0,Peel-Works is a tech and data analytics company specializing in e-commerce for corner stores.,2020,2010.0,"Sachin Chhabra, Nidhi Ramachandran",CESC Ventures,Mumbai,Maharashtra,India
814,201,Janani,IT & Technology,Validation,200000.0,Janani aims to make the process of infertility treatment and assisted fertilisation easier,2020,2020.0,Nilay Mehrotra,9Unicorns,Bangalore,Karnataka,India
815,202,Credgenics,IT & Technology,Early Traction,3300000.0,"Credgenics is a tech-enabled platform backed by Titan Capital, helping fintech lenders and Banks in their critical NPA reduction",2020,2018.0,"Anand Agrawal, Mayank Khera, Rishabh Goel",Accel,Gurugram,Haryana,India
816,203,Finelistings,Retail and E-commerce,Unknown,3000000.0,A Used Luxury Car Marketplace,2020,2015.0,Aneesh Mathur,Justdial,Delhi,Delhi,India
817,204,Wellversed,Healthcare & Life Sciences,Scaling,3000000.0,Wellversed Health enables production of customised clinical food products specific to health requirements of a demography or an individual.,2020,2018.0,"Aanan Khurma, Aditya Seth, Ripunjay Chachan",KLUB Works,Delhi,Delhi,India
818,206,Jumbotail,Retail and E-commerce,Scaling,11000000.0,"Jumbotail is solving an important problem of organising food and grocery ecosystem in India through technology, data science and design.",2020,2015.0,"Ashish Jhina, Karthik Venkateswaran",Nexus Venture Partners and 23 High Networth Individuals (HNIs),Bangalore,Karnataka,India
819,207,Winzo,Media & Entertainment,Unknown,2000000.0,WinZO is a mobile e-sports social gaming platform that offers monetary benefits and prizes to players.,2020,2018.0,"Paavan Nanda, Saumya Singh Rathore",Makers Fund,Delhi,Delhi,India
820,208,mCaffeine,Consumer Goods,Scaling,5000000.0,"MCaffeine is a personal care brand that offers caffein-infused face, body, and hair care products.",2020,2015.0,"Tarun Sharma, Vikas Lachhwani",RPSG Ventures,Mumbai,Maharashtra,India
821,209,Pocket FM,Retail and E-commerce,Scaling,5000000.0,Pocket FM is an audiobook & podcast app that brings you over 10K+ popular audiobooks.,2020,2018.0,Rohan Nayak,Times Group,Bangalore,Karnataka,India
822,210,Snackible,Healthcare & Life Sciences,Exit Options,3000000.0,Snackible operates a health-food production company designed to sell healthy snack food via online and offline channels.,2020,2015.0,unknown,Mumbai Angels,Mumbai,Maharashtra,India
823,211,FreshtoHome,Retail and E-commerce,Unknown,16000000.0,Freshtohome is an e-commerce platform for fresh and chemical-free seafood.,2020,2015.0,Shan Kadavil,Ascent Capital,Bangalore,Karnataka,India
824,212,Jumbotail,Retail and E-commerce,Scaling,11000000.0,Jumbotail is solving an important problem of organising food and grocery ecosystem in India,2020,2015.0,"Ashish Jhina, Karthik Venkateswaran",Nexus Venture Partners,Bangalore,Karnataka,India
825,213,Nykaa,Retail and E-commerce,Unknown,3000000.0,Nykaa is an online marketplace for different beauty and wellness products.,2020,2012.0,Falguni Nayar,Katrina Kaif,Mumbai,Maharashtra,India
826,214,TagZ Foods,Retail and E-commerce,Unknown,3000000.0,TagZ Foods is a supplier of snacks and food products.,2020,2019.0,"Sagar Bhalotia, Anish Basu Roy",Exfinity Venture Partners,Bangalore,Karnataka,India
827,215,Genius Teacher,IT & Technology,Unknown,2000000.0,"Genius Teacher creates engaging educational content, delivers fun learning experience to the students",2020,2016.0,"Advitiya Sharma, Gaurav Lahoti",Sandeep Tandon,Mumbai,Maharashtra,India
828,216,Krimanshi Feeds,Retail and E-commerce,Unknown,500000.0,Krimanshi aims to increase rural income by improving the productivity of Indian cattle with better quality feed.,2020,2015.0,Nikhil Bohra,Rajasthan Venture Capital Fund,Jodhpur,Rajasthan,India
829,217,Origo,IT & Technology,Exit Options,4000000.0,Provider of marketing and warehousing services for agricultural commodities.,2020,2010.0,"Sunoor Kaul,",Northern Arc Capital,Gurugram,Haryana,India
830,218,GetVantage,IT & Technology,Early Traction,5000000.0,GetVantage is India and Southeast Asia's first fintech enabled Revenue-based financing platform.,2020,2019.0,"Amit Srivastava, Bhavik Vasa, Sachin Tagra, Sachin Tagra",Samyakth Capital,Mumbai,Maharashtra,India
831,219,Betterplace,IT & Technology,Scaling,10000000.0,Developer of a digital verification platform designed to manage the semi-formal workforce.,2020,2015.0,"Saurabh Tandan, Pravin Agarwala",Jungle Ventures,Bangalore,Karnataka,India
832,220,Biddano,Healthcare & Life Sciences,Scaling,600000.0,India's 1st tech-enabled healthcare logistics platform.,2020,2016.0,Talha Shaikh,Windrose Capital,Mumbai,Maharashtra,India
833,221,InVideo,Retail and E-commerce,Scaling,15000000.0,InVideo enables you to transform your content into great videos.,2020,2017.0,"Harsh Vakharia, Pankit Chheda, Sanket Shah",Base Partners,Mumbai,Maharashtra,India
834,222,Arzooo,IT & Technology,Scaling,7500000.0,"Retail tech platform empowering 300,000+ small retailers in electronics space to compete with big organised players and increase sales",2020,2016.0,"Khushnud Khan, Rishi Raj Rathore",3Lines,Bangalore,Karnataka,India
835,223,Hubilo,IT & Technology,Early Traction,4500000.0,World’s smartest virtual event platform that brings Experience & Intelligence together,2020,2020.0,"Mayank Agarwal, Vaibhav Jain",Nishant Rao,San Francisco,unknown,United States
836,224,BASIC Home Loan,IT & Technology,Early Traction,5000000.0,"A platform for automating home loans for middle and low-income households in India,",2020,2020.0,Atul Monga,Picus Capital,Gurugram,Haryana,India
837,225,Ketos,Retail and E-commerce,Unknown,18000000.0,KETOS provides hardware and software analytics solutions and real-time data for usage and flow across water systems.,2020,2015.0,Meena Sankaran,Citi Ventures,San Francisco,unknown,United States
838,226,SUGAR cosmetics,Consumer Goods,Exit Options,2000000.0,It is a cruelty-free makeup brand providing cosmetics that is high on style and higher on performance.,2020,2012.0,"Kasuhik Mukherjee, Vineeta Singh",A91 Partners,Mumbai,Maharashtra,India
839,227,Signzy,IT & Technology,Unknown,5400000.0,It is creating 'building blocks for a Digital Trust system.,2020,2015.0,"Ankit Ratan, Ankur Pandey, Arpit Ratan",GenNext Ventures,Bangalore,Karnataka,India
840,228,Ahaguru,IT & Technology,Scaling,3000000.0,"It is conducting IIT JEE Coach for Physics, Math and Chemistry easily.",2020,2012.0,"Gomathi S, Dr Balaji Sampath",Anand Mahindra,Chennai,Tamil Nadu,India
841,229,Tekion,Retail and E-commerce,Scaling,150000000.0,It is a cloud-built platform with advanced machine learning and AI capabilities for a personalized and seamless consumer experience.,2020,2016.0,"Guru Sankararaman, Jay Vijayan",Alliance Ventures,San Ramon,unknown,unknown
842,230,Brighteye Ventures,IT & Technology,Unknown,5400000.0,Education technology venture capital firm.,2020,2017.0,David guerin,Tandem,Paris,unknown,France
843,231,EzeRx,IT & Technology,Early Traction,200000.0,Developer and manufacturer of medical devices,2020,2018.0,"Amit mandahar, Chaitali roy",Indian Oil Corporation,Kolkata,West Bengal,India
844,232,VitalTech,IT & Technology,Early Traction,3000000.0,"VitalTech is a develop technologies that empower patients to better care for their safety,",2020,2018.0,Anjan Panneer Selvam,Tech Mahindra,Plano,unknown,United States
845,233,Genius Teacher,IT & Technology,Unknown,2000000.0,"Genius Teacher creates engaging educational content, delivers fun learning experience to the students",2020,2016.0,"Advitiya Sharma, Gaurav Lahoti",Whiteboard Capital,Mumbai,Maharashtra,India
846,234,Ultraviolette Automotive,Retail and E-commerce,Scaling,4000000.0,Ultraviolette Automotive is a technology startup working on electric two-wheelers and energy infrastructure.,2020,2014.0,"Narayan Subramaniam, Niraj Rajmohan",TVS Motor Company,Bangalore,Karnataka,India
847,235,Tring,Media & Entertainment,Unknown,3000000.0,"Tring is a celebrity engagement platform, for all occasions including birthday, anniversaries, get well soon messages.",2020,2019.0,"Akshay Saini, Rahul Saini, Pranav Chabhadia",Sujeet Kumar,Mumbai,Maharashtra,India
848,236,Rare Planet,Retail and E-commerce,Scaling,400000.0,Rare Planet sells handicrafts made by local artisans.,2020,2015.0,"Ranodeep Saha, Vijay Kumar",Venture Catalysts,Kolkata,West Bengal,India
849,237,GoodGamer,Media & Entertainment,Early Traction,2500000.0,GoodGamer is India's first Daily Fantasy Sports and true Esports gaming platform.,2020,2020.0,Charles Creighton,Undisclosed,Bangalore,Karnataka,India
850,238,InnAccel,IT & Technology,Scaling,1500000.0,"A building a portfolio of novel medical devices designed, engineered, and priced for global Emerging Markets.",2020,2012.0,Siraj Dhanani,Mount Judi Ventures,Bangalore,Karnataka,India
851,239,Tiliter,Retail and E-commerce,Unknown,7500000.0,Software that uses computer vision to recognise products without barcodes,2020,2017.0,"Chris Sampson, Marcel Herz, Martin Karafilis",AngelList,Sydney,unknown,unknown
852,240,Slintel,Media & Entertainment,Unknown,4200000.0,"Slintel, a leader in capturing technographics-powered buying intent, helps companies uncover the 3% of active buyers in their target market.",2020,2016.0,"Deepak Anchala, Rahul Bhattacharya, Ranjana TN",Accel,San Francisco,unknown,West Coast
853,241,SoOLEGAL,IT & Technology,Unknown,4000000.0,"SoOLEGAL is a global integrated directory of lawyers, legal aid organizations, and Law firms.",2020,2015.0,Manish Kaul,Undisclosed,Delhi,Delhi,India
854,242,HobSpace,IT & Technology,Early Traction,200000.0,India's Activity Hub for Kids,2020,2019.0,"Priya Goel Sheth, Harsh Jain",Artha Venture,Mumbai,Maharashtra,India
855,243,Supplynote,Retail and E-commerce,Early Traction,500000.0,Supplynote is India's leading procurement platform with a unique stack of SAAS and E-commerce to solve the procurement problem,2020,2015.0,"Abhishek Verma, Harshit Mittal, Kumar Kushang, Nitin Prakash",MOX,Noida,Uttar Pradesh,India
856,244,Hire Me Car,Retail and E-commerce,Early Traction,3000000.0,India's largest cloud based digital discovery and services provisioning platform for the taxi rental,2020,2017.0,Pankaj Sharma,Undisclosed,Noida,Uttar Pradesh,India
857,245,ShopUp,Retail and E-commerce,Scaling,22000000.0,"ShopUp provides easy access to B2B sourcing, last-mile logistics, digital credit, and business management solutions to small businesses.",2020,2017.0,"Afeef Zaman, Ataur Rahim Chowdhury, Siffat Sarwar",Flourish Ventures,unknown,unknown,Bangladesh
858,246,Harmonizer India,IT & Technology,Unknown,3000000.0,"Energy-efficient solutions based on the Artificial Intelligence, Machine Learning and Internet of Things technology,",2020,2019.0,M R Srinivas,Kapil Dev,Bangalore,Karnataka,India
859,247,Zomato,IT & Technology,Unknown,52000000.0,Zomato is a food delivery and restaurant discovery site that provides information and reviews about restaurants.,2020,2008.0,"Deepinder Goyal, Gaurav Gupta, Pankaj Chaddah",Kora,Gurugram,Haryana,India
860,248,Dukaan,IT & Technology,Early Traction,6000000.0,Developer of an android application designed for businesses to sell online.,2020,2020.0,"Subhash Choudhary, Suumit Shah",Lightspeed,Mumbai,Maharashtra,India
861,249,CredR,Retail and E-commerce,Unknown,2000000.0,India’s Only 100% Inspected and Certified Used Bikes Marketplace.,2020,2014.0,"Nikhil Jain, Nittin Mittal, Sumit Chhazed",Eight Roads Ventures,Mumbai,Maharashtra,India
