,index,company_name,industry,funding_stage,Amount_in_usd,about_company,year_funded,Founded,Founders,Investor,city,state,country
1484,873,Oda Class,IT & Technology,Early Traction,3000000.0,"It offers content and material via video, adopting a dual-teacher model with IIT and NIT alumni",2020,2015.0,"Li Yong, Shushant Srivastava",Yuanfudao,Bangalore,Karnataka,India
1485,874,Spinny,Retail and E-commerce,Scaling,43700000.0,Used car retailing platform,2020,2015.0,"Niraj Singh, Mohit Gupta, Ramanshu Mahuar",Nandan Nilekani,unknown,unknown,unknown
1486,875,goStops,Retail and E-commerce,Unknown,3000000.0,A premium chain of youth hostels catering to the millennials,2020,2012.0,"Pallavi Agarwal, Pankaj Parwanda",Atraxn Partners.,Delhi,Delhi,India
1487,876,Umeed Housing,IT & Technology,Scaling,23000000.0,Housing finance company,2020,2016.0,Ashutosh Sharma,Morgan Stanley Private Equity Asia,unknown,unknown,unknown
1488,877,Vogo,Manufacturing,Scaling,20000000.0,A scooter-sharing platform allowing users to rent a two-wheeler from specific designated pick up points,2020,2016.0,"Anand Ayyadurai, Padmanabhan Balakrishnan, Sanchit Mittal",Lightstone Aspada,Bangalore,Karnataka,India
1489,878,Flick Stree,Retail and E-commerce,Scaling,3000000.0,Artificial intelligence-based video publishing network,2020,2016.0,Saurabh Singh,Samsung Venture Investment,Mumbai,Maharashtra,India
1490,879,Qure ai,IT & Technology,Unknown,16000000.0,Provides interpretations of radiology scans,2020,2016.0,"Prashant Warier, Pooja Rao",Sequoia India,Mumbai,Maharashtra,India
1491,880,MinionLabs,Retail and E-commerce,Unknown,3000000.0,It leverages a Machine Learning-based approach to generate a comprehensive report on predictive analytics,2020,2015.0,Gokul Shrinivas,Indian Angel Network,Bangalore,Karnataka,India
1492,881,Josh Talks,Retail and E-commerce,Early Traction,1500000.0,Community of young individuals providing a platform to showcase their stories,2020,2015.0,"Supriya Paul, Shobhit Banga",Media Development Investment Fund,unknown,unknown,unknown
1493,882,PhoneParLoan,IT & Technology,Unknown,3000000.0,Provides easy loans,2020,2015.0,Ringaile Noq,Accelerator MOX,Delhi,Delhi,India
1494,883,RailYatri,Travel & Tourism,Unknown,13800000.0,A complete Indian railways app,2020,2011.0,"Manish Rathi, Kapil Raizada, Sachin Saxena",Nandan Nilekani,Noida,Uttar Pradesh,India
1495,884,AjnaLens,IT & Technology,Early Traction,1500000.0,"It leverages technologies such as AR, VR & AI to offer hardware in areas such as education and defence",2020,2014.0,"Pankaj Raut, Abhishek Tomar, Abhijit Patil",Maharashtra Defence,Thane,Maharashtra,India
1496,885,Pepper,Retail and E-commerce,Early Traction,306900.0,End to end content creation platform,2020,2017.0,Anirudh Singla and Rishabh Shekhar,Kunal Bahl,Mumbai,Maharashtra,India
1497,886,Rupeek,IT & Technology,Unknown,30000000.0,An asset backed online lending platform,2020,2015.0,"Amar Prabhu, Ashwin Soni, Sumit Maniyar",GGV Capital,Bangalore,Karnataka,India
1498,887,iMerit,Retail and E-commerce,Scaling,20000000.0,Turns information into data that is usable for machine learning processes,2020,2012.0,Radha Basu,CDC Group Plc,Kolkata,West Bengal,India
1499,888,BharatPe,IT & Technology,Scaling,75000000.0,Digital payments platform,2020,2018.0,Ashneer Grover,Ribbit Capital,Delhi,Delhi,India
1500,889,Invideo,Retail and E-commerce,Unknown,2500000.0,Video production and editing platform,2020,2017.0,Sanket Shah,Sequoia Capital’s Surge,None,unknown,unknown
1501,890,AvalonMeta,IT & Technology,Unknown,420000.0,It combines higher education and competitive gaming,2020,2017.0,"Varun Mayya, Shashank Udupa, Abhinav Arora",Peerplays,None,unknown,unknown
1502,891,Near Store,Retail and E-commerce,Early Traction,300000.0,Enables a shop to create an online presence,2020,2018.0,unknown,Sauce.vc,Mumbai,Maharashtra,India
1503,892,ElecTorq,Retail and E-commerce,Unknown,3000000.0,Electric vehicle startup,2020,2018.0,Anubhav Sharma,AdvantEdge,Delhi,Delhi,India
1504,893,Prayaan Capital,IT & Technology,Early Traction,1200000.0,"NBFC that lends to micro, small, and medium-sized enterprises (MSMEs)",2020,2018.0,"Madhan Mohan , Akash Chelvam",Accion Venture Lab,Chennai,Tamil Nadu,India
1505,894,Sanfe,Retail and E-commerce,Early Traction,1100000.0,Women health care and wellness product,2020,2018.0,"Archit Agarwal, Harry Sehrawat",SucSEED Venture Partners,Delhi,Delhi,India
1506,895,Go Desi,IT & Technology,Early Traction,627300.0,Provides traditional delicacies,2020,2018.0,Vinay Kothari,Rukam Capital,Delhi,Delhi,India
1507,896,Swiggy,IT & Technology,Scaling,113000000.0,Platform to order food online from restaurants and getting it delievered,2020,2014.0,"Nandan Reddy, Sriharsha Majety, Rahul Jaimini",Prosus N.V,Bangalore,Karnataka,India
1508,897,Whatfix,Retail and E-commerce,Scaling,32000000.0,"Digital adoption platform that helps companies provide intuitive onboarding, training and support",2020,2014.0,"Khadim Batti, Vara Kumar",Sequoia Capital India,Bangalore,Karnataka,India
1509,898,Unacademy,IT & Technology,Scaling,110000000.0,Platform that offers online education in India,2020,2010.0,"Gaurav Munjal, Roman Saini, Hemesh Singh",Facebook,Bangalore,Karnataka,India
1510,899,Zvesta,IT & Technology,Unknown,5500000.0,An online platform where users can search and buy properties listed by developers and brokers,2020,2015.0,"Rajan Dang, Anushree Srivastava",Hindustan Media Ventures,Gurugram,Haryana,India
1511,900,Dunzo,Transportation & Logistics,Unknown,11000000.0,India-based hyperlocal delivery startup,2020,2014.0,Kabeer Biswas,Alteria Capital,Bangalore,Karnataka,India
1512,901,Digit Insurance,IT & Technology,Unknown,340000.0,General Insurance Company,2020,2019.0,Kamesh Goyal,Virat Kohli,Bangalore,Karnataka,India
1513,902,Yolo,Retail and E-commerce,Early Traction,600000.0,Intercity transportation,2020,2019.0,"Shailesh Gupta, Mukul Shah, Danish Chopra",Undisclosed,Gurugram,Haryana,India
1514,903,SmartVizX,Retail and E-commerce,Early Traction,1397000.0,It developed India’s first VR-based design communication and collaboration product Trezi,2020,2015.0,"Tithi Tewari, Gautam Tewari",Rockstud Capital,None,unknown,unknown
1515,904,MaxWholesale,Retail and E-commerce,Scaling,3000000.0,B2B ecommerce platform for kirana stores,2020,2016.0,Samarth Agrawal,IAN Fund-I,Delhi,Delhi,India
1516,905,Carbon Clean,IT & Technology,Unknown,16000000.0,Develops affordable carbon capture technology,2020,2009.0,"Aniruddha Sharma, Prateek Bumb",WAVE Equity Partners,None,unknown,unknown
1517,906,Onsitego,Retail and E-commerce,Scaling,19000000.0,It offers post-purchase services through a network of brand authorised service centres throughout the country,2020,2014.0,Mahipal,Zodius Growth Fund,None,unknown,unknown
1518,907,Genius Corner,IT & Technology,Unknown,250000.0,Framework to enable personalised learning using artificial intelligence (AI) and machine learning (ML).,2020,2014.0,"Vishal Khatter, Dheeraj Khatter, Dipak Varshney",Mahesh Mohta,Noida,Uttar Pradesh,India
1519,908,PlanetSpark,IT & Technology,Unknown,448500.0,Provides neighbourhood learning zones where children learn and develop 'new-age' skills under one roof,2020,2016.0,"Maneesh Dhooper, Kunal Malik",Indian Angel Network,Gurugram,Haryana,India
1520,909,CamCom,Retail and E-commerce,Unknown,3000000.0,AI automation platform for enterprise quality control,2020,2017.0,"Ajith Nayar, Umesh, Mahesh Subramanian",Triton Investment Advisors,Bangalore,Karnataka,India
1521,910,Simsim,Retail and E-commerce,Scaling,8000000.0,It enables community opinion influencers to sell products to thousands of micro-communities in India,2020,2015.0,Amit Bagaria,Accel Partners,Bangalore,Karnataka,India
1522,911,Shuttl,Retail and E-commerce,Scaling,7975700.0,App based bus aggregator serice,2020,2015.0,"Amit Singh, Deepanshu Malviya",SIG Global India Fund,Delhi,Delhi,India
1523,912,HooLiv,Retail and E-commerce,Unknown,3000000.0,Student Co-living startup,2020,2010.0,"Chinmoy Mishra, Gaurav Vij, and Abhishek Verma",Kolte-Patil Family Office,Delhi,Delhi,India
1524,913,ClassMonitor,IT & Technology,Unknown,3000000.0,The learning platform that blends curriculum-based activities for children,2020,2010.0,"Vijeet Pandey, Vikas Rishishwar",Ashwin Khorana,Indore,Madhya Pradesh,India
1525,914,Friyey,Retail and E-commerce,Unknown,3000000.0,Co working space startup,2020,2010.0,Yogesh Thore,Tarun Bhalla,Pune,Maharashtra,India
1526,915,Oga,Sports,Unknown,330000.0,Provides interactive fitness experience to people across the world,2020,2010.0,Ashish Rawat,Inflection Point Ventures,Bangalore,Karnataka,India
1527,916,Big Basket,Retail and E-commerce,Unknown,3500000.0,Online grocery store,2020,2010.0,"Abhinay Choudhari, Hari Menon, Vipul Parekh, VS Sudhakar",Trifecta Capital,Bangalore,Karnataka,India
1528,917,CYFIRMA,Retail and E-commerce,Scaling,3000000.0,Offer cybersecurity services,2020,2010.0,Ritesh Kumar,Z3 Partners,Bangalore,Karnataka,India
1529,918,Innoviti,Retail and E-commerce,Unknown,5000000.0,Digital payments solutions company,2020,2010.0,Rajeev Agrawal,FMO,Bangalore,Karnataka,India
1530,919,Paytm money,IT & Technology,Unknown,5600000.0,Wealth Management,2020,2010.0,Vijay Shekhar Sharma,One97 Communications,Bangalore,Karnataka,India
1531,920,Vedantu,IT & Technology,Scaling,24000000.0,Onine learning platform,2020,2016.0,"Saurabh Saxena, Pulkit Jain, Anand Prakash, Vamsi Krishna",GGV Capital,Bangalore,Karnataka,India
1532,921,Yap,IT & Technology,Unknown,1402000.0,Banking and payment products-focused API platform,2020,2016.0,"Madhusudanan R, Muthukumar and Prabhu",Amrish Rau,Chennai,Tamil Nadu,India
1533,922,Clover,IT & Technology,Scaling,5500000.0,Provides agricultural solution to farmers working in the greenhouse production of vegetables and fruits,2020,2016.0,"Avinash BR, Gururaj Rao, Arvind Murali, Santhosh Narasipura",Omnivore,Bangalore,Karnataka,India
1534,923,Nova Credit,IT & Technology,Scaling,50000000.0,Cross-border consumer credit startup,2020,2016.0,Nicky Goulimis,Kleiner Perkins,None,unknown,unknown
1535,924,CodingNinjas,IT & Technology,Scaling,5200000.0,Online learning platform,2020,2016.0,"Singla, Kannu Mittal, Dhawal Parate",Info Edge Ltd,Delhi,Delhi,India
1536,925,Furlenco,Retail and E-commerce,Scaling,2200000.0,Furniture rental startup,2020,2011.0,Ajith Mohan Karimpana,Chowdry Associates,Bangalore,Karnataka,India
1537,926,Brick&Bolt,Retail and E-commerce,Early Traction,1500000.0,Operates in the residential construction space,2020,2018.0,"Jayesh Rajpurohit, Arpit Rajpurohit",Surge,Bangalore,Karnataka,India
1538,927,HempStreet,IT & Technology,Early Traction,1000000.0,Manufacturer of ayurvedic medicines based on cannabis,2020,2019.0,Abhishek Mohan,Pharmacon Holdings,None,unknown,unknown
1539,928,MoEngage,Media & Entertainment,Scaling,25000000.0,Customer analytics and cross-channel engagement platform,2020,2018.0,"Raviteja Dodda, Yashwanth Kumar",Eight Roads Ventures,Bangalore,Karnataka,India
1540,929,Classplus,IT & Technology,Early Traction,2500000.0,It allows coaching centres to take their brick-and-mortar setup online,2020,2018.0,"Rustagi, Bhaswat Agarwal",Blume Ventures,None,unknown,unknown
1541,930,Chaayos,Retail and E-commerce,Unknown,21500000.0,Provides customised range of tea,2020,2012.0,"Nitin Saluja, Raghav Verma",Think Investment,None,unknown,unknown
1542,931,PetPooja,Retail and E-commerce,Unknown,2000000.0,Restaurant management software provider,2020,2011.0,Apurv Patel,Udaan,Ahmedabad,Gujarat,India
1543,932,Altor,IT & Technology,Unknown,3000000.0,Makes helmets that are IoT and AI enabled,2020,2013.0,"Shamik Guha, Sayan Tapadar, Muhammad Bilal Shakil, Anirban Datta Gupta",Venture Catalysts,None,unknown,unknown
1544,933,Pepperfry,Retail and E-commerce,Scaling,40000000.0,Online home furniture marketplace,2020,2013.0,"Ambareesh Murty, Ashish Shah",Pidilite Industries,Mumbai,Maharashtra,India
1545,934,FirstCry,Retail and E-commerce,Scaling,296000000.0,Baby products marketplace,2020,2010.0,"Supam Maheshwari, Amitava Saha",Softbank’s Vision Fund,Pune,Maharashtra,India
1546,935,Byju,IT & Technology,Unknown,200000000.0,Provides online learning classes,2020,2011.0,Byju Raveendran,General Atlantic,None,unknown,unknown
1547,936,Waycool,IT & Technology,Scaling,32000000.0,Food development and distribution services,2020,2015.0,Karthick Jayraman and Sanjay Dasari,LightBox Ventures,Chennai,Tamil Nadu,India
1548,937,WorkIndia,IT & Technology,Unknown,6000000.0,An online and mobile-based platform that connects companies with blue collar employees.,2020,2018.0,Kunal Patil,Xiaomi,None,unknown,unknown
1549,938,Qyuki,Retail and E-commerce,Unknown,3500000.0,Multi-channel broadcast network,2020,2018.0,"AR Rahman, Shekhar Kapur",Info Edge Venture Fund,Mumbai,Maharashtra,India
1550,939,Leap India,IT & Technology,Scaling,30000000.0,Agricultural warehousing and logistics company,2020,2018.0,Narain Karthikeyan.,Neev Fund,Coimbatore,Tamil Nadu,India
1551,940,Picxy,Retail and E-commerce,Unknown,250000.0,Stock photo industry,2020,2018.0,Jitendra Emmani,FirstCheque,Hyderabad,Telangana,India
1552,941,Krimanshi,IT & Technology,Unknown,20000.0,Sustainable system to feed animals by valorizing food residues and surplus into highly nutritious feeds,2020,2018.0,Nikhil Bohra,Arunachal Pradesh Social Entrepreneurship Meet,Jodhpur,Rajasthan,India
1553,942,NEETprep,IT & Technology,Unknown,3000000.0,Provides crash course for NEET preparation,2020,2018.0,Kapil Gupta,IndiaQuotient,Delhi,Delhi,India
1554,943,Dot Pvt. Ltd,IT & Technology,Early Traction,8000000.0,It provides digital transformation and commerce solutions to brick and mortar outlets,2020,2018.0,Shailaz Nag,PayU,Gurugram,Haryana,India
1555,944,Kuku FM,Retail and E-commerce,Scaling,5500000.0,A podcast platform,2020,2018.0,"Lal Chand Bisu, Vikas Goyal, Vinod Kumar Meena",Vertex Ventures,Mumbai,Maharashtra,India
1556,945,SuperMoney,IT & Technology,Early Traction,1000000.0,Provides financial tools for effective business making,2020,2018.0,Nikhil Banerjee,Unitus Ventures.,Mumbai,Maharashtra,India
1557,946,Rebel Foods,IT & Technology,Unknown,4900000.0,It runs internet kitchen,2020,2015.0,"Jaydeep Barman, Kallol Bannerjee",Alteria Capital,None,unknown,unknown
1558,947,AlphaVector,Retail and E-commerce,Unknown,3000000.0,It sells modern age bicycles named FROG,2020,2015.0,Sachin Chopra,Avaana Capital,Bangalore,Karnataka,India
1559,948,Fox Capital,IT & Technology,Unknown,2500000.0,Digital lending startup,2020,2019.0,Rakesh Sharma,Institutional Investors,Jaipur,Rajasthan,India
1560,949,Tribe Theory,Retail and E-commerce,Unknown,3500000.0,An entrepreneur-focused hostel chain present in multiple locations across the world.,2020,2017.0,Katie Russel and Daniel Wiegand,Tim Draper,Bangalore,Karnataka,India
1561,950,Fleetx,Retail and E-commerce,Scaling,1402400.0,Fleet management and predictive analytics platform,2020,2017.0,"Vineet Sharma, Abhay Jeet Gupta, Udbhav Rai, Parveen Kataria, Vishal Misra",Beenext,None,unknown,unknown
1562,951,Embibe,IT & Technology,Unknown,12618300.0,It provides AI-based data analytics to personalise learning outcomes,2020,2017.0,Aditi Avasthi,Reliance Industries Limited (RIL),Mumbai,Maharashtra,India
1563,952,Entri,IT & Technology,Early Traction,1400000.0,It is a app that provides different types of learning content in local languages,2020,2017.0,"Mohammed Hisamuddin, Rahul Ramesh",Good Capital,Cochin,Kerala,India
1564,953,Oye! Rickshaw,Retail and E-commerce,Scaling,10000000.0,App-based electric rickshaw hailing service,2020,2012.0,Akash Deep,Chiratae Ventures,None,unknown,unknown
1565,954,Seal Professional,IT & Technology,Early Traction,3000000.0,Trains students in managemnt and leadership skills and also helps in placement,2020,2012.0,unknown,Equanimity Ventures,Bangalore,Karnataka,India
1566,955,Sprinng Foods,Retail and E-commerce,Unknown,3000000.0,Provides Gluten-free food,2020,2015.0,Tarun Khanna,Mistletoe,Mumbai,Maharashtra,India
1567,956,1MG,IT & Technology,Unknown,9900000.0,Online pharmacy,2020,2015.0,"Prashant Tandon, Gaurav Agarwal, Vikas Chauhan",Bill & Melinda Gates Foundation,Gurugram,Haryana,India
1568,957,Aagey,IT & Technology,Unknown,3000000.0,Provides financial assistance to MSMEs,2020,2017.0,Akaash Shankar,JITO Angel Network,Bangalore,Karnataka,India
1569,958,Doubtnut,IT & Technology,Scaling,15000000.0,Multi-lingual digital solutions platform for students,2020,2017.0,"Tanushri Nagori, Aditya Shankar",Tencent,Gurugram,Haryana,India
1570,959,AdonMo,IT & Technology,Unknown,3000000.0,It is an online and outdoor advertising company,2020,2017.0,"Sandeep Bommireddi, Sravanth Gajula",Ant Financial,Bangalore,Karnataka,India
1571,960,RACEnergy,Retail and E-commerce,Early Traction,3000000.0,It builds electric vehicles and supporting infrastructure,2020,2018.0,"Arun Sreyas, Gautham Maheswaran",GrowX ventures,None,unknown,unknown
1572,961,BharatPe,IT & Technology,Unknown,100000000.0,Digital payments platform,2020,2018.0,Ashneer Grover,Coatue Management,Delhi,Delhi,India
1573,962,Kisan Network,IT & Technology,Early Traction,3000000.0,Integrated supply chain for farmers to sell their produce directly to buyers,2020,2015.0,"Aditya Agarwalla, Sanjay Agarwalla",Atsushi Taira,Gurugram,Haryana,India
1574,963,Vogo,Manufacturing,Scaling,35000000.0,A scooter-sharing platform allowing users to rent a two-wheeler from specific designated pick up points,2020,2016.0,"Anand Ayyadurai, Padmanabhan Balakrishnan, Sanchit Mittal",Lightstone Aspada,Bangalore,Karnataka,India
1575,964,Yolo,Retail and E-commerce,Early Traction,600000.0,Intercity transportation startup,2020,2019.0,"Shailesh Gupta, Mukul Shah, Danish Chopra",Undisclosed,Gurugram,Haryana,India
1576,965,Unotech,Retail and E-commerce,Unknown,2000000.0,It develops fully-customisable open source software,2020,2011.0,Vikash Jha,Manish Choksi,Mumbai,Maharashtra,India
1577,966,Zetwerk,Retail and E-commerce,Unknown,2200000.0,B2B marketplace that connects manufacturing companies for industrial equipements,2020,2018.0,"Amrit Acharya, Srinath Ramakkrushnan, Vishal Chaudhary",InnoVen capital,Bangalore,Karnataka,India
1578,967,CureSkin,IT & Technology,Unknown,500000.0,Provides a treatment solution for skincare and hair fall issues with an artificial intelligence-enabled solution,2020,2017.0,"Guna Kakulapati, Rama Rajanna, Charu Sharma",SenseAI Ventures,Bangalore,Karnataka,India
1579,968,WizKlub,IT & Technology,Early Traction,982530.0,Helps students solve problems at complex level,2020,2018.0,Amit Bansal,Incubate Fund India,Bangalore,Karnataka,India
1580,969,Interviewbit,IT & Technology,Scaling,200000000.0,Platform that provides coding and interview preparation course by industry professionals from tech companies,2020,2014.0,Abhimanyu Saxena,Tiger Global Management,Pune,Maharashtra,India
1581,970,MoneyTap,IT & Technology,Scaling,70185200.0,App-based consumer credit line that gives customers access to credit on tap.,2020,2016.0,"Bala Parthasarathy, Anuj Kacker, Kunal Varma",Aquiline Technology Growth (ATG),None,unknown,unknown
1582,971,Uniplatform Tech,Retail and E-commerce,Unknown,3000000.0,Runs real estate SaaS platform MultiplyMyLeads.com.,2020,2015.0,"Rohit Manghnani, Amit K Jaiswal, Iccha Manghnani",Frontline Strategy Finds,Delhi,Delhi,India
1583,972,INdwealth,IT & Technology,Scaling,12000000.0,An Artificial Intelligence and Machine learning based wealth management platform,2020,2015.0,Ashish Kashyap,Tiger Global,Gurugram,Haryana,India
1584,973,Bizongo,Retail and E-commerce,Scaling,30000000.0,A B2B marketplace for packaging materials,2020,2015.0,"Sachin Agarwal, Aniket Deb, Ankit Tomar",Schroder Adveq,Mumbai,Maharashtra,India
1585,974,AppsFlyer,Retail and E-commerce,Scaling,210000000.0,Mobile marketing analytics and attribution platform,2020,2011.0,"Oren Kaniel, Reshef Mann",General Atlantic,Bangalore,Karnataka,India
1586,975,Digit Insurance,IT & Technology,Unknown,84000000.0,General Insurance Company,2020,2014.0,Kamesh Goyal,A91 Partners,Bangalore,Karnataka,India
1587,976,Livspace,Retail and E-commerce,Scaling,60000000.0,It offers end-to-end home design experience for homeowners and home designers,2020,2014.0,"Anuj Srivastava, Ramakant Sharma, Shagufta Anurag",Tahoe Investment Group,Bangalore,Karnataka,India
1588,977,GetVantage,IT & Technology,Early Traction,3000000.0,Revenue based finance provider,2020,2018.0,Bhavik Vasa,Samyakth Capital,Mumbai,Maharashtra,India
1589,978,Konfinity,IT & Technology,Unknown,3000000.0,Provides online coding courses,2020,2018.0,"Navratn Singh, Kamal Pandey",Angel investors,Noida,Uttar Pradesh,India
1590,979,Pine Labs,IT & Technology,Unknown,3000000.0,Retail payment and hardware company,2020,2016.0,"Lokvir Kapoor, Rajul Garg, Tarun Upaday",Mastercard,Noida,Uttar Pradesh,India
1591,980,Instoried,Retail and E-commerce,Unknown,3000000.0,Augmented writing platform which improves customer interest and engagement.,2020,2016.0,Sharmin Ali,SOSV,Delhi,Delhi,India
1592,981,Nupay,Financial Services,Unknown,3000000.0,"Integrated platform for Receivables and Payables automation, Electronic Invoicing, Reconciliations and Bank payouts",2020,2016.0,"Neeraj Singh, Alok Arora",Venture Catalysts,unknown,unknown,unknown
1593,982,LogiNext,Retail and E-commerce,Scaling,39000000.0,"It helps logistics companies to improve internal operations, optimise delivery networks and provide customer service",2020,2016.0,"Dhruvil Sanghvi, Manisha Raisinghani",Tiger Global,None,unknown,unknown
1594,983,Samosa Singh,Retail and E-commerce,Scaling,2700000.0,Offers hygienic Indian Snacks,2020,2016.0,"Shikhar Veer Singh, Nidhi Singh",She Capital,Bangalore,Karnataka,India
1595,984,Crysta,IT & Technology,Early Traction,1403400.0,Offers diagnostic and screening services with regular counselling and clinical data management,2020,2018.0,unknown,Green Shots Capital,Delhi,Delhi,India
1596,985,Eupheus Learning,IT & Technology,Scaling,4300000.0,"Provides technology-led, subscription-based learning solutions to schools",2020,2017.0,"Sarvesh Shrivastava, Ved Prakash Khatri, Amit Kapoor",Yuj Ventures,Delhi,Delhi,India
1597,986,Bounce,Manufacturing,Scaling,105000000.0,Offers a variety of bikes and scooters that can be rented on a subscription basis,2020,2014.0,"Vivekananda Hallekere, Anil Giri Raju,Arun Agni",Accel Partners,Bangalore,Karnataka,India
1598,987,Park+,IT & Technology,Unknown,11000000.0,It is engaged in bringing digitization in parking,2020,2017.0,Amit Lakhotia,Sequoia Capital,None,unknown,unknown
1599,988,Goodmylk,Retail and E-commerce,Early Traction,400000.0,Provides Vegan dairy products,2020,2017.0,Abhay Rangan,Ginni International,Bangalore,Karnataka,India
1600,989,SmartKarrot,Retail and E-commerce,Unknown,1000000.0,It tracks customers’ real-time digital behaviour,2020,2019.0,"Prithwi Dasgupta, Arnab Chatterjee",Angel investors,None,unknown,unknown
1601,990,Skylo,IT & Technology,Scaling,103000000.0,Provides affordable and ever present network that connects machines or sensors,2020,2017.0,Trivedi,SoftBank Group,None,unknown,unknown
1602,991,Tea Trunk,Retail and E-commerce,Unknown,220000.0,Global premium tea brand,2020,2013.0,"Snigdha Manchanda, Vikas Kumar, Aishwarya Malhi",Angel investors,unknown,unknown,unknown
1603,992,Zoomcar,Retail and E-commerce,Scaling,30000000.0,A car rental service platform,2020,2013.0,"Greg Moran, David Back",Sony Innovation Fund,Bangalore,Karnataka,India
1604,993,Mera Cashier,IT & Technology,Early Traction,250000.0,App meant for small and micro businessmen to manage their transactions digitally,2020,2019.0,"Suneel Kumar, Sucharita Reddy, Gaurav Tomar, Akhilesh Nigam,",Amit Singal,Noida,Uttar Pradesh,India
1605,994,Samya AI,Retail and E-commerce,Early Traction,6000000.0,Revenue growth AI startup in the consumer packed goods (CPG) space,2020,2019.0,"Shailendra Singh, Deepinder Dhingra, Pavan Palety",Sequoia India,None,unknown,unknown
1606,995,Kristal AI,Retail and E-commerce,Scaling,6000000.0,Provides Algorithm-based financial services,2020,2016.0,"Asheesh Chanda, Vineeth Narasimhan",Chiratae Ventures,None,unknown,unknown
1607,996,Invento Robotics,Retail and E-commerce,Early Traction,281300.0,Known for Mitra Series of Robots,2020,2018.0,"Balaji Viswanathan, Be Limitless Inc., Zingfin.com, NalandaU",Windrose Capital,None,unknown,unknown
1608,997,Zimyo,IT & Technology,Unknown,3000000.0,Automates everyday HR processes with integrated solutions,2020,2018.0,"Kumar Mayank, Ajay Kadyan",Yatra Angel Network (YAN),Gurugram,Haryana,India
1609,998,Sabse Sasta Dukaan,Healthcare & Life Sciences,Unknown,3000000.0,Online pharmacy dealing in medicines,2020,2016.0,"Anish Agarwal, Anant Jain",Angel investors,Kolkata,West Bengal,India
1610,999,Fitphilia,IT & Technology,Unknown,3000000.0,Provides IoT-enabled treadmill,2020,2010.0,Nirav Patil,Angel investors,Mumbai,Maharashtra,India
1611,1000,Medicus,IT & Technology,Unknown,12700.0,AI-based platform that explains and interprets blood tests and medical reports,2020,2010.0,"Bhavesh Shah, Manav Shah",Angel investors,Mumbai,Maharashtra,India
1612,1001,Monech,IT & Technology,Early Traction,12700.0,Automated platform which will help users to take their financial decisions,2020,2010.0,unknown,Angel investors,Mumbai,Maharashtra,India
1613,1002,Teach Us,IT & Technology,Early Traction,12700.0,Educational portal which enables the students to access information related to education at one common platform,2020,2010.0,unknown,Angel investors,None,unknown,unknown
1614,1003,Dealberg,Business Services,Unknown,3000000.0,Deals in office supplies,2020,2010.0,Abhishek Emmanuel,Undisclosed,Bangalore,Karnataka,India
1615,1004,Phenom People,IT & Technology,Scaling,30000000.0,It redefines the means to search for a job and recruit top talent,2020,2010.0,Mahe Bayireddi,WestBridge Capital,None,unknown,unknown
1616,1005,Extra Edge,IT & Technology,Early Traction,700000.0,Admission Marketing Automation software for the education industry,2020,2016.0,Kavita Dhillon,Sprout Venture Partners,Pune,Maharashtra,India
